{
  "version": 1,
  "channel": "stable",
  "issued_at": "2026-05-19T00:00:00Z",
  "releases": [
    {
      "version": "0.1.0",
      "min_supported_from": "0.0.1",
      "release_notes_url": "https://iogrid.org/releases/0.1.0",
      "artifacts": [
        {
          "target": "aarch64-apple-darwin",
          "url": "https://releases.iogrid.org/0.1.0/iogridd-darwin-arm64",
          "sha256": "0000000000000000000000000000000000000000000000000000000000000000",
          "size_bytes": 5242880
        },
        {
          "target": "x86_64-apple-darwin",
          "url": "https://releases.iogrid.org/0.1.0/iogridd-darwin-amd64",
          "sha256": "0000000000000000000000000000000000000000000000000000000000000000",
          "size_bytes": 5242880
        },
        {
          "target": "x86_64-unknown-linux-gnu",
          "url": "https://releases.iogrid.org/0.1.0/iogridd-linux-amd64",
          "sha256": "0000000000000000000000000000000000000000000000000000000000000000",
          "size_bytes": 5242880
        },
        {
          "target": "aarch64-unknown-linux-gnu",
          "url": "https://releases.iogrid.org/0.1.0/iogridd-linux-arm64",
          "sha256": "0000000000000000000000000000000000000000000000000000000000000000",
          "size_bytes": 5242880
        },
        {
          "target": "x86_64-pc-windows-msvc",
          "url": "https://releases.iogrid.org/0.1.0/iogridd-windows-amd64.exe",
          "sha256": "0000000000000000000000000000000000000000000000000000000000000000",
          "size_bytes": 5242880
        }
      ]
    }
  ],
  "signature": {
    "algorithm": "ed25519",
    "key_id": "iogrid-update-2026-1",
    "value": "REPLACE_WITH_BASE64_ED25519_SIG"
  }
}
